{
  "previous_loop": "Autonomous 1.01 Stress Run 001 Iteration 02 restored UNKNOWN to three public first-trial V12 completion-state surfaces.",
  "v12_status": "PASS",
  "residue": [
    "The copy-paste Next-Action Confidence Check exposes PASS / DELAY / BLOCK / UNKNOWN",
    "The Loop Library copy exposes the same four-state contract",
    "The Codex tutorial preserves the same four state labels",
    "An exact schema-to-prompt parity check passed"
  ],
  "load_bearing_improvement": {
    "declared_improvement": "Preserve canonical uncertainty at the actual first-use surface instead of accepting a polished but incomplete public prompt.",
    "comparable_implementation_load": "During a bounded repeated-selection iteration, Revenue and discovery candidates were unavailable or inadmissible while both the observed contract defect and more expansive adoption artifacts were available.",
    "observed_behavior_under_load": "The executor selected the exact three-site contract correction and did not add a framework, fixture, validator, tutorial expansion, or lower-priority presentation work.",
    "protected_object_preserved": "The canonical four-state meaning, UNKNOWN non-GO handling, Human Decision Seat, main identity, and public evidence boundaries remained unchanged.",
    "evidence_source": "validation/autonomous_1_01_stress_run_001/iteration_02.md; implementation commit 05f0c49754215769e708d309775779050c8c2f1a; evidence-record commit c3d2a3d1619080ef32d9f67bf3c97d063ac6c3f8",
    "compliance": "PASS CANDIDATE",
    "improvement_credit": "GRANTED — CASE-BOUNDED"
  },
  "successor_transfer": {
    "deferred_cost": "Duplicated public prompt surfaces may drift from the canonical schema if their completion-state contract changes later.",
    "successor_owner": "Repository maintainer",
    "receipt_or_acceptance": "The maintenance condition and exact parity recheck are disclosed in the immutable Iteration 02 record.",
    "next_loop_effect": "LIGHTER",
    "disclosure_status": "Disclosed in the Iteration 02 record and this machine-readable example.",
    "closure_or_re_evaluation_condition": "Re-run exact four-state parity and all-example schema validation when the schema enum or any copied first-trial prompt changes.",
    "classification": "VALID TRANSFER"
  },
  "next_variable": "Freshly select the highest-priority qualifying variable from the repository state after Iteration 02.",
  "carrier_impact": {
    "fatigue": "low",
    "money": "low",
    "attention": "low",
    "credibility": "low",
    "trust": "low"
  },
  "re_entry_capacity": {
    "status": "preserved",
    "notes": "The source record, implementation commit, evidence-record commit, validation condition, and case boundary are explicit."
  },
  "gate": "GO",
  "cap_or_recheck": "Treat this as one case-bounded schema-integration example only. Do not infer final run success, general reliability, cross-model behavior, or merge authority.",
  "next_loop_command": "Inspect the current experiment-branch state and stop successfully if no further qualifying 1.01 exists."
}
